{"active_mesh_anchor_count":1,"annotation_completeness":{"missing":[],"present":["listening_position:primary","speaker:C","speaker:L","speaker:R"],"required":[]},"benchmark_refs":[],"depth_evidence_count":1,"diagnostics":[{"code":"tracking_unavailable_recovered","evidence_refs":[],"message":"AR tracking was unavailable for 0.0s and recovered; the interval is retained as a warning.","severity":"warning"},{"code":"operator_declared_region","evidence_refs":[],"message":"region=behind_sofa","severity":"info"},{"code":"revisit_flag","evidence_refs":[],"message":"flag_id=1 kind=coverage","severity":"info"}],"evidence_frame_count":2,"integrity_status":"pass","measurement_completeness":{"missing":[],"present":["room_width"],"required":[]},"ready_for_htdt_ingestion":true,"resource_events":[{"detail":"transient memory pressure at second 30","kind":"memory_pressure","severity":"warning"}],"roomplan_status":"completed","ruleset_version":"1.2.0","schema":"htdt.capture.quality","schema_version":"1.0.0","tracking_events":[{"session_timestamp_s":1,"state":"normal"},{"reason":"excessive_motion","session_timestamp_s":5,"state":"unavailable"},{"session_timestamp_s":12,"state":"normal"},{"session_timestamp_s":25,"state":"normal"}],"usable_depth_sample_count":1024,"usable_mesh_anchor_count":1}