{"active_mesh_anchor_count":1,"annotation_completeness":{"missing":[],"present":[],"required":[]},"benchmark_refs":[],"depth_evidence_count":0,"diagnostics":[],"evidence_frame_count":0,"integrity_status":"pass","measurement_completeness":{"missing":[],"present":[],"required":[]},"ready_for_htdt_ingestion":true,"resource_events":[],"roomplan_status":"completed","ruleset_version":"1.0.0","schema":"htdt.capture.quality","schema_version":"1.0.0","tracking_events":[{"reason":null,"session_timestamp_s":0.0,"state":"normal"}]}